{
  "schema":"fde-agent/semantic-metric-definition/v1","metric_id":"ap-exception-cycle-time","version":"1.0.0","name":"AP exception cycle time","description":"Elapsed seconds from exception creation to resolved state.","owner_role":"ap-process-owner","source_system_id":"synthetic-erp","unit":"seconds","currency":null,"timezone":"Asia/Taipei","grain":"CASE","aggregation":"PERCENTILE","scope":{"tenant_ref":"tenant-demo","process_id":"ap-invoice-po-exception","population_filter":"synthetic=true"},"effective_time":{"valid_from":"2026-01-01T00:00:00Z","valid_to":null},"lineage_subjects":[{"subject_type":"source-manifest","subject_id":"source-ap-events","digest":"aaaaaaaaaaaaaaaaaaaaaaaaaaaaaaaaaaaaaaaaaaaaaaaaaaaaaaaaaaaaaaaa"}],"status":"ACTIVE"
}
